{
  "format": "ac-umtc",
  "version": "0.1",
  "encoding": "float",
  "number_field": "cyclotomic(16)",
  "category_type": "umtc",
  "_meta": { "note": "Minimal Ising UMTC input placeholder; F/R omitted in v0" },

  "simple_objects": ["1", "psi", "sigma"],

  "dual": {
    "1": "1",
    "psi": "psi",
    "sigma": "sigma"
  },

  "fusion_rules": {
    "(1,1)": { "1": 1 },
    "(1,psi)": { "psi": 1 },
    "(1,sigma)": { "sigma": 1 },

    "(psi,1)": { "psi": 1 },
    "(psi,psi)": { "1": 1 },
    "(psi,sigma)": { "sigma": 1 },

    "(sigma,1)": { "sigma": 1 },
    "(sigma,psi)": { "sigma": 1 },
    "(sigma,sigma)": { "1": 1, "psi": 1 }
  },

  "F_symbols": null,
  "R_symbols": null
}
