{
  "format": "ac-umtc",
  "version": "0.1",
  "encoding": "float",
  "number_field": "cyclotomic(8)",
  "category_type": "umtc",
  "_meta": { "note": "Minimal UMTC input placeholder; F/R omitted in v0" },

  "simple_objects": ["1", "e", "m", "em"],

  "dual": {
    "1": "1",
    "e": "e",
    "m": "m",
    "em": "em"
  },

  "fusion_rules": {
    "(1,1)": { "1": 1 },
    "(1,e)": { "e": 1 },
    "(1,m)": { "m": 1 },
    "(1,em)": { "em": 1 },

    "(e,1)": { "e": 1 },
    "(e,e)": { "1": 1 },
    "(e,m)": { "em": 1 },
    "(e,em)": { "m": 1 },

    "(m,1)": { "m": 1 },
    "(m,e)": { "em": 1 },
    "(m,m)": { "1": 1 },
    "(m,em)": { "e": 1 },

    "(em,1)": { "em": 1 },
    "(em,e)": { "m": 1 },
    "(em,m)": { "e": 1 },
    "(em,em)": { "1": 1 }
  },

  "F_symbols": null,
  "R_symbols": null
}
